Unnamed: 0,asin,helpful,reviewerID,reviewerName,unixReviewTime,reviewTime,overall,reviewText,summary
702,B00ABC1483,"[1, 1]",A1XYZ703,Ryan G.,1428019200,06 6 2015,4,Simply outstanding work. I came away with a completely new understanding of the subject. An absolute must have.,Perfect for learning
703,B00ABC1436,"[3, 8]",A1XYZ704,Chris Z.,1428105600,02 15 2013,2,I gave this one star because I could not give zero. The book is full of errors and contradictions. Would not recommend at all.,Very disappointing
704,B00ABC1007,"[1, 4]",A1XYZ705,Joseph R.,1428192000,02 12 2013,5,This book blew my mind. The author clearly put a lot of effort into this book. Essential reading for everyone.,Truly remarkable
705,B00ABC1416,"[7, 7]",A1XYZ706,Paul M.,1428278400,02 8 2013,3,Not bad but not great either. The first half was good but the second half lost momentum.,"Not bad, not great"
706,B00ABC1372,"[1, 2]",A1XYZ707,Andrew N.,1428364800,04 20 2013,2,Do not buy this! Most of the content is filler and adds no value whatsoever. I regret purchasing this book.,"Regret buying, avoid"
707,B00ABC1316,"[1, 2]",A1XYZ708,Chris C.,1428451200,03 1 2014,3,Not bad but not great either. The first half was good but the second half lost momentum.,"Not bad, not great"
708,B00ABC1351,"[0, 1]",A1XYZ709,William G.,1428537600,08 5 2014,4,Captivating and thoroughly enjoyable. The author has a unique voice that keeps you engaged from start to finish. I am so glad I decided to buy it.,"Beautifully crafted, deeply insightful"
709,B00ABC1476,"[0, 4]",A1XYZ710,Lisa F.,1428624000,02 18 2012,5,This book blew my mind. The author has an incredible ability to draw you in and keep you hooked. Essential reading for everyone.,Truly remarkable
710,B00ABC1343,"[0, 0]",A1XYZ711,Laura G.,1428710400,09 20 2015,5,Absolutely loved this book. The author clearly put a lot of effort into this book. I am so glad I decided to buy it.,Brilliant masterpiece
711,B00ABC1067,"[1, 4]",A1XYZ712,Ryan D.,1428796800,09 16 2014,5,This is the definitive book on the subject. The writing style is engaging and the content is very well structured. I am so glad I decided to buy it.,Exceeded all expectations
712,B00ABC1143,"[1, 1]",A1XYZ713,Melissa G.,1428883200,01 5 2015,5,I cannot say enough good things about this book. The level of detail is impressive and the writing flows beautifully. Five stars without hesitation.,Simply outstanding
713,B00ABC1251,"[4, 4]",A1XYZ714,Steven E.,1428969600,06 14 2013,2,Absolutely dreadful. The sentences are confusing and the structure is a mess. I returned it immediately and asked for a refund.,One star is too generous
714,B00ABC1133,"[1, 3]",A1XYZ715,Mike O.,1429056000,01 8 2013,2,Awful experience reading this. The book feels like it was written in a hurry with lots of grammatical errors. I regret purchasing this book.,Boring and mediocre
715,B00ABC1057,"[0, 0]",A1XYZ716,Dorothy O.,1429142400,06 23 2015,5,"Excellent book, very well researched. The level of detail is impressive and the writing flows beautifully. Would definitely recommend it to friends and family.",Superb content
716,B00ABC1421,"[2, 3]",A1XYZ717,Deborah V.,1429228800,03 27 2013,2,Awful experience reading this. The author clearly did not do enough research. Do not waste your money.,"Full of errors, avoid"
717,B00ABC1346,"[2, 8]",A1XYZ718,Linda O.,1429315200,07 3 2013,5,A revelation from cover to cover. The author explains complex ideas in a simple and accessible way. I am so glad I decided to buy it.,"Amazing read, loved it"
718,B00ABC1041,"[2, 6]",A1XYZ719,Claire M.,1429401600,10 4 2014,5,Simply outstanding work. The writing style is engaging and the content is very well structured. An absolute must have.,Truly inspiring
719,B00ABC1375,"[0, 10]",A1XYZ720,Steven E.,1429488000,06 2 2015,4,Beautifully crafted and deeply insightful. The author writes with passion and authority on every page. An absolute must have.,Truly remarkable
720,B00ABC1280,"[4, 10]",A1XYZ721,Deborah T.,1429574400,06 26 2012,1,I gave this one star because I could not give zero. The writing is terrible and the plot makes no sense. Not worth the price.,Boring and mediocre
721,B00ABC1083,"[0, 2]",A1XYZ722,Jason H.,1429660800,07 3 2012,1,Not what I expected at all. The author clearly did not do enough research. A complete waste of money.,"Total mess, waste of money"
722,B00ABC1308,"[3, 4]",A1XYZ723,Stephanie Y.,1429747200,07 24 2014,5,This book blew my mind. Every chapter is filled with valuable insights and relatable examples. Five stars without hesitation.,Truly inspiring
723,B00ABC1307,"[3, 3]",A1XYZ724,Rachel J.,1429833600,08 13 2015,5,"Wonderful storytelling throughout. It completely changed my perspective on the topic. Buy it now, you will not regret it.",Wonderful journey
724,B00ABC1174,"[1, 2]",A1XYZ725,Mike V.,1429920000,11 14 2012,5,"A wonderful journey from start to finish. I came away with a completely new understanding of the subject. Buy it now, you will not regret it.",Truly remarkable
725,B00ABC1464,"[8, 8]",A1XYZ726,Barbara T.,1430006400,02 10 2015,1,This book is a total mess. The information is incorrect in many places and the writing is painfully bad. Save your money.,"Not great, too much filler"
726,B00ABC1469,"[3, 3]",A1XYZ727,Betty T.,1430092800,05 19 2012,2,Do not buy this! The writing is terrible and the plot makes no sense. Save your money.,"Dreadful, full of errors"
727,B00ABC1299,"[1, 1]",A1XYZ728,Brian B.,1430179200,11 24 2014,5,"Wonderful storytelling throughout. The writing is sharp, the ideas are original and the execution is flawless. Essential reading for everyone.","A revelation, landmark publication"
728,B00ABC1360,"[0, 2]",A1XYZ729,Edward C.,1430265600,07 2 2012,5,I cannot say enough good things about this book. The writing style is engaging and the content is very well structured. Would definitely recommend it to friends and family.,"Beautifully crafted, deeply insightful"
729,B00ABC1040,"[4, 9]",A1XYZ730,Susan W.,1430352000,06 28 2013,5,A revelation from cover to cover. The author has an incredible ability to draw you in and keep you hooked. A worthwhile investment.,"Beautifully crafted, deeply insightful"
730,B00ABC1335,"[0, 8]",A1XYZ731,John W.,1430438400,01 13 2012,2,Regret buying this. The sentences are confusing and the structure is a mess. Avoid at all costs.,Appalling quality
731,B00ABC1044,"[4, 4]",A1XYZ732,Michelle N.,1430524800,10 12 2015,4,This book blew my mind. It completely changed my perspective on the topic. I am so glad I decided to buy it.,Superb content
732,B00ABC1223,"[0, 3]",A1XYZ733,Carol C.,1430611200,04 16 2013,5,This book is absolutely amazing. The author explains complex ideas in a simple and accessible way. Would definitely recommend it to friends and family.,"Amazing read, loved it"
733,B00ABC1462,"[2, 7]",A1XYZ734,Anna W.,1430697600,08 14 2012,2,Appalling quality. The book is full of errors and contradictions. Avoid at all costs.,"Dreadful, full of errors"
734,B00ABC1004,"[3, 7]",A1XYZ735,Lisa F.,1430784000,04 10 2015,5,"Excellent book, very well researched. The author writes with passion and authority on every page. A worthwhile investment.","Amazing read, loved it"
735,B00ABC1262,"[8, 9]",A1XYZ736,Patricia O.,1430870400,05 2 2015,5,A wonderful journey from start to finish. The level of detail is impressive and the writing flows beautifully. A worthwhile investment.,Insightful and well written
736,B00ABC1137,"[0, 0]",A1XYZ737,Betty T.,1430956800,07 19 2014,4,Truly inspiring and thought provoking. I learned so much from reading this book. A worthwhile investment.,Changed my perspective
737,B00ABC1147,"[5, 7]",A1XYZ738,Sarah W.,1431043200,08 23 2015,1,Absolutely dreadful. The editing is nonexistent and the structure is completely absent. I regret purchasing this book.,Misleading description
738,B00ABC1436,"[3, 8]",A1XYZ739,Eric U.,1431129600,10 22 2014,2,This book should never have been published. The content is shallow and lacks depth. I regret purchasing this book.,"Disappointing, not worth it"
739,B00ABC1409,"[6, 6]",A1XYZ740,Peter O.,1431216000,11 21 2014,2,I want my money back. The writing is terrible and the plot makes no sense. I returned it immediately and asked for a refund.,"Regret buying, avoid"
740,B00ABC1251,"[1, 1]",A1XYZ741,Tom U.,1431302400,03 6 2013,1,Complete garbage. The content is recycled and the author adds nothing new to the conversation. Not worth the price.,"Dreadful, full of errors"
741,B00ABC1081,"[0, 3]",A1XYZ742,Brian Y.,1431388800,01 12 2014,5,A wonderful journey from start to finish. The author writes with passion and authority on every page. An absolute must have.,Changed my perspective
742,B00ABC1249,"[0, 6]",A1XYZ743,Betty C.,1431475200,10 8 2012,5,I cannot say enough good things about this book. The writing style is engaging and the content is very well structured. Would definitely recommend it to friends and family.,Definitive book on the subject
743,B00ABC1474,"[4, 8]",A1XYZ744,Jessica K.,1431561600,03 28 2012,5,"Simply outstanding work. I came away with a completely new understanding of the subject. Buy it now, you will not regret it.",Brilliant masterpiece
744,B00ABC1085,"[9, 9]",A1XYZ745,Walter R.,1431648000,02 27 2012,1,I want my money back. The description was very misleading and the content is generic. Avoid at all costs.,Misleading description
745,B00ABC1186,"[3, 4]",A1XYZ746,Claire Q.,1431734400,09 16 2012,4,"This is a must read! I learned so much from reading this book. Buy it now, you will not regret it.",Exceeded all expectations
746,B00ABC1258,"[6, 6]",A1XYZ747,Karen N.,1431820800,01 8 2015,5,Outstanding quality and research. The storytelling is brilliant and the characters are very well developed. Cannot recommend it enough.,"Beautifully crafted, deeply insightful"
747,B00ABC1070,"[10, 10]",A1XYZ748,Peter C.,1431907200,04 5 2015,5,Perfect book for anyone interested in this topic. The author has a unique voice that keeps you engaged from start to finish. Essential reading for everyone.,"Loved it, flawless execution"
748,B00ABC1367,"[5, 8]",A1XYZ749,Linda M.,1431993600,01 15 2013,2,Absolutely dreadful. The editing is nonexistent and the structure is completely absent. A complete waste of money.,Should never have been published
749,B00ABC1018,"[6, 6]",A1XYZ750,Patricia X.,1432080000,03 14 2012,2,I could not finish this book. The author clearly did not do enough research. Do not waste your money.,"Horrible, avoid at all costs"
750,B00ABC1453,"[0, 9]",A1XYZ751,Edward G.,1432166400,11 23 2014,3,Decent book overall. Has its moments but also has its flaws. Worth reading if you are really interested in the topic.,Decent but flawed
751,B00ABC1312,"[2, 4]",A1XYZ752,Stephanie V.,1432252800,06 1 2014,3,An average book for an average price. Nothing memorable but nothing terrible.,Average book
752,B00ABC1400,"[9, 9]",A1XYZ753,Ryan A.,1432339200,11 15 2014,1,"Not what I expected at all. The writing is flat, the content is predictable. Not worth the price.",Fell short of expectations
753,B00ABC1145,"[0, 0]",A1XYZ754,Ruth I.,1432425600,07 24 2013,4,This is a must read! I learned so much from reading this book. An absolute must have.,Outstanding and informative
754,B00ABC1276,"[5, 5]",A1XYZ755,Ryan A.,1432512000,03 1 2012,5,"I cannot say enough good things about this book. The writing is sharp, the ideas are original and the execution is flawless. An absolute must have.",Wonderful journey
755,B00ABC1259,"[1, 8]",A1XYZ756,Chris Q.,1432598400,12 2 2014,4,Captivating and thoroughly enjoyable. It completely changed my perspective on the topic. An absolute must have.,"A revelation, landmark publication"
756,B00ABC1412,"[4, 4]",A1XYZ757,Karen C.,1432684800,12 1 2015,5,Fantastic read from start to finish. I came away with a completely new understanding of the subject. Would definitely recommend it to friends and family.,"Beautifully crafted, deeply insightful"
757,B00ABC1266,"[2, 3]",A1XYZ758,Jessica G.,1432771200,05 10 2013,2,I gave this one star because I could not give zero. The content is recycled and the author adds nothing new to the conversation. Very disappointed with this purchase.,One star is too generous
758,B00ABC1424,"[2, 3]",A1XYZ759,Jessica L.,1432857600,08 4 2013,2,Very bad quality overall. The content is shallow and lacks depth. Very disappointed with this purchase.,Loses momentum quickly
759,B00ABC1206,"[3, 7]",A1XYZ760,Sharon V.,1432944000,08 3 2014,5,One of the best books I have read this year. The writing style is engaging and the content is very well structured. Essential reading for everyone.,"Must read, absolutely brilliant"
760,B00ABC1485,"[7, 9]",A1XYZ761,William H.,1433030400,11 14 2015,4,I cannot say enough good things about this book. I came away with a completely new understanding of the subject. Essential reading for everyone.,Simply outstanding
761,B00ABC1262,"[2, 8]",A1XYZ762,Robert Z.,1433116800,08 23 2015,4,A wonderful journey from start to finish. It completely changed my perspective on the topic. Five stars without hesitation.,"Must read, absolutely brilliant"
762,B00ABC1308,"[0, 7]",A1XYZ763,Eric R.,1433203200,12 6 2014,1,Very bad quality overall. Most of the content is filler and adds no value whatsoever. Not worth the price.,Should never have been published
763,B00ABC1191,"[0, 4]",A1XYZ764,Nancy N.,1433289600,09 5 2012,2,Very bad quality overall. The author clearly did not do enough research. Do not waste your money.,Loses momentum quickly
764,B00ABC1419,"[6, 9]",A1XYZ765,Susan W.,1433376000,01 10 2014,5,Beautifully crafted and deeply insightful. The writing style is engaging and the content is very well structured. Five stars without hesitation.,"Must read, absolutely brilliant"
765,B00ABC1460,"[0, 1]",A1XYZ766,Joseph D.,1433462400,07 16 2014,2,"Terrible book, waste of money and time. The author clearly did not do enough research. Very disappointed with this purchase.",Want my money back
766,B00ABC1076,"[2, 2]",A1XYZ767,Richard D.,1433548800,11 15 2015,5,This book blew my mind. The author writes with passion and authority on every page. I am so glad I decided to buy it.,"Must read, absolutely brilliant"
767,B00ABC1490,"[3, 6]",A1XYZ768,Henry K.,1433635200,04 13 2014,1,Worst book I have ever read. The author clearly did not do enough research. One star because zero is not possible.,One star is too generous
768,B00ABC1407,"[0, 4]",A1XYZ769,Joseph Q.,1433721600,03 23 2012,3,Not bad but not great either. The first half was good but the second half lost momentum.,"Not bad, not great"
769,B00ABC1096,"[0, 1]",A1XYZ770,Joseph V.,1433808000,10 18 2012,2,Do not buy this! The book feels like it was written in a hurry with lots of grammatical errors. Avoid at all costs.,Fell short of expectations
770,B00ABC1125,"[8, 10]",A1XYZ771,Peter H.,1433894400,03 1 2014,2,Hugely disappointing. The editing is nonexistent and the structure is completely absent. Would not recommend at all.,Misleading description
771,B00ABC1478,"[5, 9]",A1XYZ772,Maria M.,1433980800,07 19 2012,2,"I gave this one star because I could not give zero. The writing is flat, the content is predictable. Avoid at all costs.",Fell short of expectations
772,B00ABC1277,"[5, 8]",A1XYZ773,Anna R.,1434067200,07 9 2012,5,A wonderful journey from start to finish. The research is thorough and the conclusions are very insightful. Essential reading for everyone.,"Amazing read, loved it"
773,B00ABC1492,"[1, 2]",A1XYZ774,Lisa U.,1434153600,07 22 2013,5,Outstanding quality and research. The research is thorough and the conclusions are very insightful. An absolute must have.,Outstanding and informative
774,B00ABC1132,"[0, 6]",A1XYZ775,Stephanie F.,1434240000,06 5 2015,5,This book is absolutely amazing. The author has an incredible ability to draw you in and keep you hooked. Highly recommend to anyone interested in this topic.,A real gem
775,B00ABC1031,"[9, 9]",A1XYZ776,Anna B.,1434326400,04 16 2015,5,Wonderful storytelling throughout. The writing style is engaging and the content is very well structured. Cannot recommend it enough.,Changed my perspective
776,B00ABC1493,"[0, 0]",A1XYZ777,Rachel I.,1434412800,11 8 2012,5,This is the definitive book on the subject. The level of detail is impressive and the writing flows beautifully. Would definitely recommend it to friends and family.,Superb content
777,B00ABC1256,"[4, 4]",A1XYZ778,Jason Q.,1434499200,07 15 2012,4,Wonderful storytelling throughout. The author explains complex ideas in a simple and accessible way. I finished it in two days and immediately bought the sequel.,"Must read, absolutely brilliant"
778,B00ABC1237,"[3, 3]",A1XYZ779,John G.,1434585600,09 15 2012,5,Outstanding quality and research. The author has a unique voice that keeps you engaged from start to finish. I finished it in two days and immediately bought the sequel.,Exceeded all expectations
779,B00ABC1194,"[0, 0]",A1XYZ780,Amanda Y.,1434672000,05 20 2014,1,Regret buying this. The sentences are confusing and the structure is a mess. Save your money.,Very disappointing
780,B00ABC1202,"[0, 0]",A1XYZ781,Laura T.,1434758400,12 18 2012,1,Disappointing and frustrating. The content is recycled and the author adds nothing new to the conversation. Very disappointed with this purchase.,"Dreadful, full of errors"
781,B00ABC1484,"[4, 8]",A1XYZ782,Ryan Y.,1434844800,07 7 2014,3,Decent book overall. Has its moments but also has its flaws. Worth reading if you are really interested in the topic.,Decent but flawed
782,B00ABC1008,"[2, 3]",A1XYZ783,Charles F.,1434931200,06 7 2015,5,Perfect book for anyone interested in this topic. I came away with a completely new understanding of the subject. A worthwhile investment.,Simply outstanding
783,B00ABC1458,"[0, 7]",A1XYZ784,Edward I.,1435017600,01 22 2013,1,Awful experience reading this. The information is incorrect in many places and the writing is painfully bad. Would not recommend at all.,One star is too generous
784,B00ABC1456,"[4, 6]",A1XYZ785,Henry M.,1435104000,02 26 2012,3,Not bad but not great either. The first half was good but the second half lost momentum.,"Not bad, not great"
785,B00ABC1393,"[6, 6]",A1XYZ786,Helen G.,1435190400,10 12 2015,2,I want my money back. The information is incorrect in many places and the writing is painfully bad. Avoid at all costs.,Want my money back
786,B00ABC1348,"[3, 3]",A1XYZ787,Kenneth B.,1435276800,01 8 2012,2,"Terrible book, waste of money and time. The author clearly did not do enough research. I regret purchasing this book.",Want my money back
787,B00ABC1018,"[4, 10]",A1XYZ788,Maria S.,1435363200,12 8 2013,1,Very poor content. The book is full of errors and contradictions. Avoid at all costs.,One star is too generous
788,B00ABC1252,"[6, 10]",A1XYZ789,Joseph V.,1435449600,02 28 2014,5,Truly inspiring and thought provoking. The author explains complex ideas in a simple and accessible way. Highly recommend to anyone interested in this topic.,Perfect for learning
789,B00ABC1065,"[2, 9]",A1XYZ790,Deborah T.,1435536000,02 19 2013,5,"This is a must read! The explanations are clear, the examples are practical. I am so glad I decided to buy it.",Truly remarkable
790,B00ABC1452,"[1, 4]",A1XYZ791,Sharon I.,1435622400,11 1 2014,5,A revelation from cover to cover. It completely changed my perspective on the topic. Cannot recommend it enough.,Wonderful journey
791,B00ABC1238,"[6, 6]",A1XYZ792,Sharon V.,1435708800,07 9 2012,4,"A wonderful journey from start to finish. The explanations are clear, the examples are practical. Highly recommend to anyone interested in this topic.",Definitive book on the subject
792,B00ABC1200,"[0, 0]",A1XYZ793,Steven M.,1435795200,07 18 2015,4,I cannot say enough good things about this book. I came away with a completely new understanding of the subject. Highly recommend to anyone interested in this topic.,Changed my perspective
793,B00ABC1159,"[3, 3]",A1XYZ794,Tom F.,1435881600,02 8 2013,5,One of the best books I have read this year. I learned so much from reading this book. I am so glad I decided to buy it.,"Amazing read, loved it"
794,B00ABC1490,"[0, 0]",A1XYZ795,Frank C.,1435968000,05 8 2012,5,Wonderful storytelling throughout. The writing style is engaging and the content is very well structured. A worthwhile investment.,"A revelation, landmark publication"
795,B00ABC1320,"[0, 3]",A1XYZ796,Kenneth R.,1436054400,10 20 2015,5,"Fantastic read from start to finish. It completely changed my perspective on the topic. Buy it now, you will not regret it.",Wonderful journey
796,B00ABC1410,"[2, 6]",A1XYZ797,Lisa H.,1436140800,12 3 2013,5,Wonderful storytelling throughout. The storytelling is brilliant and the characters are very well developed. Highly recommend to anyone interested in this topic.,Brilliant masterpiece
797,B00ABC1205,"[0, 1]",A1XYZ798,Jason G.,1436227200,09 2 2014,5,A real gem of a book. The author clearly put a lot of effort into this book. Essential reading for everyone.,Outstanding and informative
798,B00ABC1317,"[0, 0]",A1XYZ799,Ryan U.,1436313600,07 15 2015,5,A wonderful journey from start to finish. The author explains complex ideas in a simple and accessible way. I am so glad I decided to buy it.,Truly remarkable
799,B00ABC1034,"[3, 9]",A1XYZ800,Charles Z.,1436400000,02 4 2012,5,This book is absolutely amazing. The author writes with passion and authority on every page. I finished it in two days and immediately bought the sequel.,Definitive book on the subject
800,B00ABC1317,"[8, 10]",A1XYZ801,Frank E.,1436486400,05 12 2015,4,This is a must read! I learned so much from reading this book. I am so glad I decided to buy it.,"Must read, absolutely brilliant"
801,B00ABC1453,"[1, 2]",A1XYZ802,Laura J.,1436572800,10 14 2014,5,Captivating and thoroughly enjoyable. The research is thorough and the conclusions are very insightful. Highly recommend to anyone interested in this topic.,Brilliant masterpiece
802,B00ABC1336,"[5, 9]",A1XYZ803,Ruth J.,1436659200,05 12 2012,4,Outstanding quality and research. The research is thorough and the conclusions are very insightful. A worthwhile investment.,A real gem
803,B00ABC1465,"[0, 3]",A1XYZ804,Paul Q.,1436745600,07 12 2013,3,It was okay. Nothing special but nothing terrible either. Some parts were interesting but others felt repetitive.,Just okay
804,B00ABC1214,"[5, 7]",A1XYZ805,Donna N.,1436832000,10 19 2014,5,One of the best books I have read this year. The author has a unique voice that keeps you engaged from start to finish. Cannot recommend it enough.,Superb content
805,B00ABC1109,"[0, 3]",A1XYZ806,Dorothy U.,1436918400,11 8 2013,5,Wonderful storytelling throughout. The author writes with passion and authority on every page. Highly recommend to anyone interested in this topic.,Superb content
806,B00ABC1015,"[1, 6]",A1XYZ807,David S.,1437004800,01 12 2012,5,Simply outstanding work. I came away with a completely new understanding of the subject. Essential reading for everyone.,Perfect for learning
807,B00ABC1145,"[9, 10]",A1XYZ808,Paul H.,1437091200,06 2 2012,4,Outstanding quality and research. Every chapter is filled with valuable insights and relatable examples. A worthwhile investment.,Perfect for learning
808,B00ABC1134,"[3, 8]",A1XYZ809,Helen G.,1437177600,03 7 2012,5,Perfect book for anyone interested in this topic. The author has an incredible ability to draw you in and keep you hooked. Five stars without hesitation.,Definitive book on the subject
809,B00ABC1189,"[1, 10]",A1XYZ810,Dorothy C.,1437264000,06 7 2014,1,"Terrible book, waste of money and time. The description was very misleading and the content is generic. Save your money.","Regret buying, avoid"
810,B00ABC1193,"[0, 1]",A1XYZ811,Paul I.,1437350400,03 5 2013,2,Complete garbage. The book feels like it was written in a hurry with lots of grammatical errors. One star because zero is not possible.,Appalling quality
811,B00ABC1300,"[6, 9]",A1XYZ812,Kenneth U.,1437436800,11 8 2012,3,Mixed feelings about this one. Some chapters were great but others were a letdown. Average read.,Mixed feelings
812,B00ABC1435,"[0, 3]",A1XYZ813,Melissa P.,1437523200,11 26 2014,5,This is the definitive book on the subject. Every chapter is filled with valuable insights and relatable examples. Five stars without hesitation.,Definitive book on the subject
813,B00ABC1198,"[1, 1]",A1XYZ814,Tom V.,1437609600,11 20 2012,4,A revelation from cover to cover. I learned so much from reading this book. A worthwhile investment.,Perfect for learning
814,B00ABC1247,"[2, 7]",A1XYZ815,Ruth Z.,1437696000,06 23 2014,2,Hugely disappointing. The content is shallow and lacks depth. I regret purchasing this book.,"Hugely disappointing, fake reviews"
815,B00ABC1458,"[4, 7]",A1XYZ816,Susan C.,1437782400,10 13 2012,3,Not bad but not great either. The first half was good but the second half lost momentum.,"Not bad, not great"
816,B00ABC1043,"[3, 6]",A1XYZ817,Chris I.,1437868800,10 6 2014,5,Captivating and thoroughly enjoyable. The level of detail is impressive and the writing flows beautifully. Cannot recommend it enough.,A real gem
817,B00ABC1172,"[1, 5]",A1XYZ818,Walter U.,1437955200,10 2 2015,5,One of the best books I have read this year. Every chapter is filled with valuable insights and relatable examples. A worthwhile investment.,Wonderful journey
818,B00ABC1119,"[5, 7]",A1XYZ819,Helen D.,1438041600,05 13 2012,5,"Excellent book, very well researched. The level of detail is impressive and the writing flows beautifully. Essential reading for everyone.","Loved it, flawless execution"
819,B00ABC1474,"[8, 8]",A1XYZ820,Peter B.,1438128000,09 21 2012,5,One of the best books I have read this year. The author has a unique voice that keeps you engaged from start to finish. Would definitely recommend it to friends and family.,A real gem
820,B00ABC1381,"[3, 8]",A1XYZ821,Chris N.,1438214400,06 7 2014,5,"Wonderful storytelling throughout. The storytelling is brilliant and the characters are very well developed. Buy it now, you will not regret it.",Brilliant masterpiece
