Unnamed: 0,asin,helpful,reviewerID,reviewerName,unixReviewTime,reviewTime,overall,reviewText,summary
470,B00ABC1233,"[2, 7]",A1XYZ471,Sandra U.,1407974400,12 18 2013,1,Appalling quality. The editing is nonexistent and the structure is completely absent. I returned it immediately and asked for a refund.,Fell short of expectations
471,B00ABC1226,"[2, 4]",A1XYZ472,Michelle T.,1408060800,08 18 2013,4,A revelation from cover to cover. The level of detail is impressive and the writing flows beautifully. I finished it in two days and immediately bought the sequel.,Great and informative
472,B00ABC1240,"[0, 0]",A1XYZ473,Brian N.,1408147200,09 27 2013,5,A wonderful journey from start to finish. Every chapter is filled with valuable insights and relatable examples. Five stars without hesitation.,A real gem
473,B00ABC1280,"[0, 0]",A1XYZ474,Peter M.,1408233600,05 20 2013,4,Beautifully crafted and deeply insightful. I came away with a completely new understanding of the subject. A worthwhile investment.,A real gem
474,B00ABC1112,"[1, 6]",A1XYZ475,Amanda G.,1408320000,03 23 2015,5,A wonderful journey from start to finish. I learned so much from reading this book. I finished it in two days and immediately bought the sequel.,"A revelation, landmark publication"
475,B00ABC1436,"[4, 9]",A1XYZ476,Edward H.,1408406400,05 21 2014,5,"A wonderful journey from start to finish. The explanations are clear, the examples are practical. Cannot recommend it enough.",Wonderful journey
476,B00ABC1009,"[7, 9]",A1XYZ477,Paul F.,1408492800,05 23 2015,5,Outstanding quality and research. Every chapter is filled with valuable insights and relatable examples. Would definitely recommend it to friends and family.,"Beautifully crafted, deeply insightful"
477,B00ABC1119,"[2, 4]",A1XYZ478,Anthony M.,1408579200,03 23 2015,5,This is the definitive book on the subject. The writing style is engaging and the content is very well structured. Five stars without hesitation.,Truly inspiring
478,B00ABC1016,"[2, 6]",A1XYZ479,William A.,1408665600,08 12 2015,5,This book is absolutely amazing. The author writes with passion and authority on every page. Cannot recommend it enough.,Definitive book on the subject
479,B00ABC1424,"[1, 1]",A1XYZ480,Andrew G.,1408752000,03 7 2014,5,Outstanding quality and research. The writing style is engaging and the content is very well structured. An absolute must have.,"Essential reading, one of the best"
480,B00ABC1106,"[0, 0]",A1XYZ481,Ruth Y.,1408838400,08 24 2012,5,Captivating and thoroughly enjoyable. The level of detail is impressive and the writing flows beautifully. A worthwhile investment.,Changed my perspective
481,B00ABC1326,"[0, 10]",A1XYZ482,Chris O.,1408924800,12 18 2012,4,"A real gem of a book. I learned so much from reading this book. Buy it now, you will not regret it.",Exceeded all expectations
482,B00ABC1406,"[0, 1]",A1XYZ483,John W.,1409011200,11 14 2014,5,Absolutely loved this book. I learned so much from reading this book. Highly recommend to anyone interested in this topic.,Perfect for learning
483,B00ABC1045,"[0, 0]",A1XYZ484,Nancy X.,1409097600,12 20 2013,5,Wonderful storytelling throughout. The level of detail is impressive and the writing flows beautifully. Cannot recommend it enough.,"Amazing read, loved it"
484,B00ABC1405,"[0, 10]",A1XYZ485,William I.,1409184000,01 12 2013,5,Beautifully crafted and deeply insightful. The storytelling is brilliant and the characters are very well developed. I am so glad I decided to buy it.,Definitive book on the subject
485,B00ABC1193,"[5, 10]",A1XYZ486,Sarah Z.,1409270400,08 24 2013,5,"Beautifully crafted and deeply insightful. The author explains complex ideas in a simple and accessible way. Buy it now, you will not regret it.",Great and informative
486,B00ABC1095,"[4, 7]",A1XYZ487,Paul J.,1409356800,09 23 2015,5,Outstanding quality and research. Every chapter is filled with valuable insights and relatable examples. Highly recommend to anyone interested in this topic.,Superb content
487,B00ABC1419,"[8, 9]",A1XYZ488,George N.,1409443200,03 3 2013,4,Simply outstanding work. The author has an incredible ability to draw you in and keep you hooked. A worthwhile investment.,Simply outstanding
488,B00ABC1122,"[5, 6]",A1XYZ489,Linda U.,1409529600,03 1 2014,5,Absolutely loved this book. The author writes with passion and authority on every page. Highly recommend to anyone interested in this topic.,Wonderful journey
489,B00ABC1328,"[3, 3]",A1XYZ490,Steven L.,1409616000,09 5 2014,5,"One of the best books I have read this year. The explanations are clear, the examples are practical. I finished it in two days and immediately bought the sequel.","Essential reading, one of the best"
490,B00ABC1050,"[0, 2]",A1XYZ491,Maria H.,1409702400,01 7 2012,5,"Wonderful storytelling throughout. The writing is sharp, the ideas are original and the execution is flawless. Would definitely recommend it to friends and family.",Brilliant masterpiece
491,B00ABC1367,"[9, 9]",A1XYZ492,Mark U.,1409788800,05 2 2014,5,"This book blew my mind. The explanations are clear, the examples are practical. A worthwhile investment.",Wonderful journey
492,B00ABC1406,"[0, 7]",A1XYZ493,Andrew S.,1409875200,06 18 2015,5,"This is a must read! The explanations are clear, the examples are practical. A worthwhile investment.",Outstanding and informative
493,B00ABC1039,"[4, 4]",A1XYZ494,Amanda N.,1409961600,01 24 2012,3,An average book for an average price. Nothing memorable but nothing terrible.,Average book
494,B00ABC1485,"[6, 8]",A1XYZ495,Joseph Q.,1410048000,04 7 2013,1,Hugely disappointing. The author clearly did not do enough research. Avoid at all costs.,"Disappointing, not worth it"
495,B00ABC1085,"[5, 5]",A1XYZ496,Ryan R.,1410134400,08 23 2015,5,This is the definitive book on the subject. The level of detail is impressive and the writing flows beautifully. Would definitely recommend it to friends and family.,Insightful and well written
496,B00ABC1462,"[2, 10]",A1XYZ497,Rebecca S.,1410220800,09 20 2015,2,Appalling quality. The author repeats the same points over and over adding nothing new. Very disappointed with this purchase.,"Horrible, avoid at all costs"
497,B00ABC1109,"[6, 10]",A1XYZ498,Joseph I.,1410307200,12 11 2013,5,"Simply outstanding work. It completely changed my perspective on the topic. Buy it now, you will not regret it.","A revelation, landmark publication"
498,B00ABC1008,"[7, 7]",A1XYZ499,Kevin U.,1410393600,07 1 2012,5,This is the definitive book on the subject. I learned so much from reading this book. An absolute must have.,"Loved it, flawless execution"
499,B00ABC1261,"[2, 3]",A1XYZ500,Eric I.,1410480000,01 25 2014,4,A real gem of a book. The writing style is engaging and the content is very well structured. An absolute must have.,Changed my perspective
500,B00ABC1298,"[5, 7]",A1XYZ501,Nancy C.,1410566400,03 5 2014,4,A revelation from cover to cover. The research is thorough and the conclusions are very insightful. Would definitely recommend it to friends and family.,Brilliant masterpiece
501,B00ABC1405,"[6, 9]",A1XYZ502,Anthony F.,1410652800,10 7 2012,5,Perfect book for anyone interested in this topic. I came away with a completely new understanding of the subject. An absolute must have.,Outstanding and informative
502,B00ABC1028,"[4, 9]",A1XYZ503,Emma X.,1410739200,01 24 2015,4,Beautifully crafted and deeply insightful. It completely changed my perspective on the topic. I am so glad I decided to buy it.,Truly inspiring
503,B00ABC1323,"[0, 1]",A1XYZ504,Thomas X.,1410825600,12 21 2012,1,Worst book I have ever read. The content is shallow and lacks depth. A complete waste of money.,Appalling quality
504,B00ABC1344,"[2, 8]",A1XYZ505,Claire K.,1410912000,06 17 2013,5,"A real gem of a book. The writing is sharp, the ideas are original and the execution is flawless. Highly recommend to anyone interested in this topic.",Definitive book on the subject
505,B00ABC1075,"[1, 8]",A1XYZ506,Peter G.,1410998400,04 14 2014,2,"Not what I expected at all. The writing is flat, the content is predictable. One star because zero is not possible.",Loses momentum quickly
506,B00ABC1396,"[6, 8]",A1XYZ507,Walter L.,1411084800,05 3 2015,5,One of the best books I have read this year. The author writes with passion and authority on every page. I am so glad I decided to buy it.,Brilliant masterpiece
507,B00ABC1376,"[3, 7]",A1XYZ508,Betty U.,1411171200,08 13 2013,3,Decent book overall. Has its moments but also has its flaws. Worth reading if you are really interested in the topic.,Decent but flawed
508,B00ABC1216,"[5, 5]",A1XYZ509,Richard L.,1411257600,10 3 2012,4,Captivating and thoroughly enjoyable. The storytelling is brilliant and the characters are very well developed. An absolute must have.,"A revelation, landmark publication"
509,B00ABC1411,"[0, 10]",A1XYZ510,Donna G.,1411344000,05 6 2014,5,"This is a must read! The author has a unique voice that keeps you engaged from start to finish. Buy it now, you will not regret it.",Truly remarkable
510,B00ABC1027,"[2, 3]",A1XYZ511,Anna E.,1411430400,03 25 2012,5,Outstanding quality and research. The author writes with passion and authority on every page. Highly recommend to anyone interested in this topic.,Changed my perspective
511,B00ABC1241,"[0, 0]",A1XYZ512,Laura D.,1411516800,12 26 2012,5,Truly inspiring and thought provoking. I learned so much from reading this book. Five stars without hesitation.,A real gem
512,B00ABC1342,"[2, 3]",A1XYZ513,William Z.,1411603200,09 16 2013,5,This is a must read! The author has an incredible ability to draw you in and keep you hooked. I finished it in two days and immediately bought the sequel.,Perfect for learning
513,B00ABC1316,"[1, 4]",A1XYZ514,Peter Z.,1411689600,01 10 2013,5,A revelation from cover to cover. I learned so much from reading this book. I finished it in two days and immediately bought the sequel.,Brilliant masterpiece
514,B00ABC1009,"[5, 6]",A1XYZ515,Melissa R.,1411776000,05 22 2014,5,"Excellent book, very well researched. The explanations are clear, the examples are practical. Highly recommend to anyone interested in this topic.",Outstanding and informative
515,B00ABC1256,"[1, 1]",A1XYZ516,Helen H.,1411862400,08 28 2012,5,This book blew my mind. The author explains complex ideas in a simple and accessible way. Essential reading for everyone.,Wonderful journey
516,B00ABC1009,"[2, 3]",A1XYZ517,Deborah W.,1411948800,06 16 2015,1,Appalling quality. The editing is nonexistent and the structure is completely absent. Would not recommend at all.,Boring and mediocre
517,B00ABC1455,"[4, 8]",A1XYZ518,Ryan G.,1412035200,01 21 2014,5,Absolutely loved this book. The author has a unique voice that keeps you engaged from start to finish. An absolute must have.,Changed my perspective
518,B00ABC1195,"[1, 2]",A1XYZ519,Emma E.,1412121600,07 22 2013,1,"Terrible book, waste of money and time. The book feels like it was written in a hurry with lots of grammatical errors. I returned it immediately and asked for a refund.","Disappointing, not worth it"
519,B00ABC1067,"[1, 3]",A1XYZ520,George I.,1412208000,07 10 2014,4,Truly inspiring and thought provoking. It completely changed my perspective on the topic. Cannot recommend it enough.,"A revelation, landmark publication"
520,B00ABC1499,"[1, 2]",A1XYZ521,Barbara H.,1412294400,12 23 2013,5,Outstanding quality and research. The author clearly put a lot of effort into this book. I finished it in two days and immediately bought the sequel.,Perfect for learning
521,B00ABC1391,"[0, 1]",A1XYZ522,Anthony M.,1412380800,03 11 2013,2,I gave this one star because I could not give zero. The editing is nonexistent and the structure is completely absent. Save your money.,"Horrible, avoid at all costs"
522,B00ABC1094,"[4, 10]",A1XYZ523,James P.,1412467200,03 25 2013,5,A wonderful journey from start to finish. The level of detail is impressive and the writing flows beautifully. An absolute must have.,"Beautifully crafted, deeply insightful"
523,B00ABC1013,"[9, 9]",A1XYZ524,Mark Y.,1412553600,04 20 2013,5,Truly inspiring and thought provoking. The author clearly put a lot of effort into this book. An absolute must have.,Truly remarkable
524,B00ABC1070,"[5, 7]",A1XYZ525,Maria O.,1412640000,03 28 2015,5,Beautifully crafted and deeply insightful. The research is thorough and the conclusions are very insightful. I finished it in two days and immediately bought the sequel.,Truly remarkable
525,B00ABC1033,"[3, 4]",A1XYZ526,Kenneth H.,1412726400,04 24 2013,5,Captivating and thoroughly enjoyable. The writing style is engaging and the content is very well structured. Essential reading for everyone.,"Amazing read, loved it"
526,B00ABC1311,"[3, 5]",A1XYZ527,Linda K.,1412812800,04 14 2015,5,"Excellent book, very well researched. It completely changed my perspective on the topic. I am so glad I decided to buy it.",Superb content
527,B00ABC1231,"[9, 9]",A1XYZ528,Ruth R.,1412899200,10 18 2012,2,Not what I expected at all. Most of the content is filler and adds no value whatsoever. Do not waste your money.,"Regret buying, avoid"
528,B00ABC1322,"[6, 8]",A1XYZ529,Ruth X.,1412985600,12 2 2015,4,Fantastic read from start to finish. I learned so much from reading this book. Cannot recommend it enough.,Wonderful journey
529,B00ABC1470,"[2, 4]",A1XYZ530,Kevin U.,1413072000,08 6 2015,1,Disappointing and frustrating. The sentences are confusing and the structure is a mess. I regret purchasing this book.,"Regret buying, avoid"
530,B00ABC1299,"[7, 10]",A1XYZ531,Helen X.,1413158400,02 24 2012,5,I cannot say enough good things about this book. I learned so much from reading this book. Five stars without hesitation.,"Beautifully crafted, deeply insightful"
531,B00ABC1364,"[3, 5]",A1XYZ532,Sandra C.,1413244800,01 6 2015,1,Appalling quality. The writing is terrible and the plot makes no sense. A complete waste of money.,Appalling quality
532,B00ABC1361,"[2, 10]",A1XYZ533,Emma R.,1413331200,12 24 2012,1,I want my money back. The author clearly did not do enough research. I returned it immediately and asked for a refund.,"Horrible, avoid at all costs"
533,B00ABC1087,"[2, 8]",A1XYZ534,Mike X.,1413417600,07 18 2015,5,Absolutely loved this book. The storytelling is brilliant and the characters are very well developed. I finished it in two days and immediately bought the sequel.,"Essential reading, one of the best"
534,B00ABC1373,"[0, 2]",A1XYZ535,Laura N.,1413504000,12 2 2015,1,I gave this one star because I could not give zero. The description was very misleading and the content is generic. Save your money.,"Poor quality, rushed writing"
535,B00ABC1254,"[0, 2]",A1XYZ536,John D.,1413590400,01 20 2014,2,I want my money back. The sentences are confusing and the structure is a mess. Save your money.,Misleading description
536,B00ABC1226,"[3, 7]",A1XYZ537,Dorothy L.,1413676800,04 19 2015,2,Appalling quality. The book promised a lot but delivered very little. Would not recommend at all.,One star is too generous
537,B00ABC1075,"[4, 4]",A1XYZ538,Lisa W.,1413763200,11 18 2013,5,Truly inspiring and thought provoking. The writing style is engaging and the content is very well structured. Cannot recommend it enough.,Great and informative
538,B00ABC1025,"[9, 10]",A1XYZ539,Eric T.,1413849600,10 10 2014,5,Absolutely loved this book. The writing style is engaging and the content is very well structured. Five stars without hesitation.,Brilliant masterpiece
539,B00ABC1296,"[9, 10]",A1XYZ540,Dorothy E.,1413936000,10 26 2013,5,Superb content and beautifully written. The research is thorough and the conclusions are very insightful. An absolute must have.,Truly remarkable
540,B00ABC1033,"[3, 5]",A1XYZ541,Amanda I.,1414022400,02 25 2015,5,Fantastic read from start to finish. The storytelling is brilliant and the characters are very well developed. An absolute must have.,Definitive book on the subject
541,B00ABC1055,"[6, 8]",A1XYZ542,Donna K.,1414108800,09 7 2013,5,Outstanding quality and research. The storytelling is brilliant and the characters are very well developed. An absolute must have.,Definitive book on the subject
542,B00ABC1294,"[3, 4]",A1XYZ543,Chris V.,1414195200,10 28 2014,4,I cannot say enough good things about this book. The storytelling is brilliant and the characters are very well developed. A worthwhile investment.,Truly remarkable
543,B00ABC1092,"[7, 9]",A1XYZ544,Maria A.,1414281600,09 24 2015,1,Very poor content. The editing is nonexistent and the structure is completely absent. Save your money.,One star is too generous
544,B00ABC1106,"[0, 0]",A1XYZ545,Deborah M.,1414368000,01 15 2012,1,This book is a total mess. Most of the content is filler and adds no value whatsoever. I returned it immediately and asked for a refund.,Worst book ever
545,B00ABC1353,"[4, 5]",A1XYZ546,Thomas H.,1414454400,11 7 2012,2,Absolutely dreadful. The author repeats the same points over and over adding nothing new. Would not recommend at all.,"Horrible, avoid at all costs"
546,B00ABC1370,"[5, 8]",A1XYZ547,Karen G.,1414540800,01 4 2014,5,One of the best books I have read this year. Every chapter is filled with valuable insights and relatable examples. An absolute must have.,Wonderful journey
547,B00ABC1330,"[2, 5]",A1XYZ548,Michelle K.,1414627200,11 16 2015,4,This book is absolutely amazing. It completely changed my perspective on the topic. Five stars without hesitation.,Perfect for learning
548,B00ABC1153,"[3, 5]",A1XYZ549,Amanda V.,1414713600,07 24 2012,5,"Outstanding quality and research. The explanations are clear, the examples are practical. A worthwhile investment.",Great and informative
549,B00ABC1015,"[2, 3]",A1XYZ550,Rachel G.,1414800000,06 3 2013,4,"Simply outstanding work. The writing is sharp, the ideas are original and the execution is flawless. I finished it in two days and immediately bought the sequel.","Amazing read, loved it"
550,B00ABC1384,"[9, 9]",A1XYZ551,Melissa A.,1414886400,07 6 2012,5,"This book blew my mind. The explanations are clear, the examples are practical. I finished it in two days and immediately bought the sequel.",Exceeded all expectations
551,B00ABC1486,"[0, 6]",A1XYZ552,George G.,1414972800,08 8 2014,5,Simply outstanding work. The author has an incredible ability to draw you in and keep you hooked. Highly recommend to anyone interested in this topic.,Simply outstanding
552,B00ABC1409,"[0, 5]",A1XYZ553,Walter M.,1415059200,04 3 2015,5,I cannot say enough good things about this book. Every chapter is filled with valuable insights and relatable examples. Five stars without hesitation.,Truly inspiring
553,B00ABC1346,"[4, 7]",A1XYZ554,Andrew V.,1415145600,06 5 2012,4,I cannot say enough good things about this book. The research is thorough and the conclusions are very insightful. Cannot recommend it enough.,Definitive book on the subject
554,B00ABC1022,"[5, 6]",A1XYZ555,Laura H.,1415232000,09 4 2012,1,Disappointing and frustrating. Most of the content is filler and adds no value whatsoever. Would not recommend at all.,Should never have been published
555,B00ABC1337,"[1, 1]",A1XYZ556,Ruth X.,1415318400,08 2 2012,3,An average book for an average price. Nothing memorable but nothing terrible.,Average book
556,B00ABC1395,"[1, 5]",A1XYZ557,Henry F.,1415404800,04 10 2014,2,"Terrible book, waste of money and time. The content is recycled and the author adds nothing new to the conversation. I returned it immediately and asked for a refund.",Worst book ever
557,B00ABC1179,"[0, 4]",A1XYZ558,Susan I.,1415491200,01 20 2012,5,Wonderful storytelling throughout. Every chapter is filled with valuable insights and relatable examples. Five stars without hesitation.,Exceeded all expectations
558,B00ABC1025,"[1, 3]",A1XYZ559,Henry D.,1415577600,02 10 2014,4,Perfect book for anyone interested in this topic. The research is thorough and the conclusions are very insightful. An absolute must have.,Insightful and well written
559,B00ABC1305,"[0, 6]",A1XYZ560,Helen Z.,1415664000,02 14 2015,5,Beautifully crafted and deeply insightful. I learned so much from reading this book. Highly recommend to anyone interested in this topic.,Truly inspiring
560,B00ABC1391,"[1, 5]",A1XYZ561,Rebecca X.,1415750400,12 25 2012,1,I want my money back. The content is recycled and the author adds nothing new to the conversation. Do not waste your money.,"Dreadful, full of errors"
561,B00ABC1485,"[4, 7]",A1XYZ562,Frank C.,1415836800,11 21 2015,4,Outstanding quality and research. The storytelling is brilliant and the characters are very well developed. A worthwhile investment.,Truly inspiring
562,B00ABC1015,"[2, 2]",A1XYZ563,Dorothy O.,1415923200,11 11 2014,5,"Truly inspiring and thought provoking. Every chapter is filled with valuable insights and relatable examples. Buy it now, you will not regret it.","Essential reading, one of the best"
563,B00ABC1207,"[1, 2]",A1XYZ564,Walter R.,1416009600,06 20 2013,5,Wonderful storytelling throughout. The author has a unique voice that keeps you engaged from start to finish. A worthwhile investment.,"Beautifully crafted, deeply insightful"
564,B00ABC1124,"[4, 4]",A1XYZ565,Janet U.,1416096000,08 13 2015,2,Very bad quality overall. The content is shallow and lacks depth. Very disappointed with this purchase.,"Full of errors, avoid"
565,B00ABC1120,"[3, 3]",A1XYZ566,Henry Z.,1416182400,07 19 2014,4,Beautifully crafted and deeply insightful. The level of detail is impressive and the writing flows beautifully. Would definitely recommend it to friends and family.,Definitive book on the subject
566,B00ABC1090,"[1, 1]",A1XYZ567,Andrew D.,1416268800,06 18 2012,5,One of the best books I have read this year. The author has an incredible ability to draw you in and keep you hooked. I am so glad I decided to buy it.,Superb content
567,B00ABC1031,"[9, 10]",A1XYZ568,Carol Y.,1416355200,07 11 2015,5,This book blew my mind. The storytelling is brilliant and the characters are very well developed. I am so glad I decided to buy it.,Truly inspiring
568,B00ABC1295,"[2, 2]",A1XYZ569,Daniel U.,1416441600,03 15 2014,5,Outstanding quality and research. I learned so much from reading this book. I am so glad I decided to buy it.,"Amazing read, loved it"
569,B00ABC1004,"[4, 9]",A1XYZ570,Emma J.,1416528000,07 23 2014,5,"This is a must read! The explanations are clear, the examples are practical. Buy it now, you will not regret it.",A real gem
570,B00ABC1420,"[0, 0]",A1XYZ571,Jessica I.,1416614400,09 2 2012,4,I cannot say enough good things about this book. The level of detail is impressive and the writing flows beautifully. Five stars without hesitation.,A real gem
571,B00ABC1364,"[3, 3]",A1XYZ572,Thomas F.,1416700800,12 19 2015,1,Very bad quality overall. The description was very misleading and the content is generic. I returned it immediately and asked for a refund.,Very disappointing
572,B00ABC1431,"[2, 10]",A1XYZ573,Betty G.,1416787200,08 5 2013,5,This book blew my mind. The level of detail is impressive and the writing flows beautifully. I finished it in two days and immediately bought the sequel.,Perfect for learning
573,B00ABC1453,"[0, 2]",A1XYZ574,Claire E.,1416873600,02 21 2012,1,Absolutely dreadful. The writing is terrible and the plot makes no sense. I returned it immediately and asked for a refund.,Complete garbage
574,B00ABC1232,"[6, 10]",A1XYZ575,Donna W.,1416960000,08 26 2015,4,A wonderful journey from start to finish. The research is thorough and the conclusions are very insightful. Would definitely recommend it to friends and family.,"Must read, absolutely brilliant"
575,B00ABC1433,"[1, 5]",A1XYZ576,Joseph O.,1417046400,03 14 2012,4,This is the definitive book on the subject. It completely changed my perspective on the topic. A worthwhile investment.,"Essential reading, one of the best"
576,B00ABC1057,"[5, 9]",A1XYZ577,Jessica S.,1417132800,01 2 2015,2,Hugely disappointing. The sentences are confusing and the structure is a mess. A complete waste of money.,Fell short of expectations
577,B00ABC1322,"[1, 7]",A1XYZ578,Janet O.,1417219200,09 20 2012,4,One of the best books I have read this year. The research is thorough and the conclusions are very insightful. I finished it in two days and immediately bought the sequel.,Simply outstanding
578,B00ABC1262,"[4, 4]",A1XYZ579,Frank D.,1417305600,01 11 2012,2,I could not finish this book. The information is incorrect in many places and the writing is painfully bad. Very disappointed with this purchase.,Loses momentum quickly
579,B00ABC1305,"[2, 5]",A1XYZ580,William H.,1417392000,05 6 2012,1,I gave this one star because I could not give zero. Most of the content is filler and adds no value whatsoever. Do not waste your money.,Appalling quality
580,B00ABC1319,"[2, 9]",A1XYZ581,Michelle E.,1417478400,10 2 2014,2,I gave this one star because I could not give zero. The sentences are confusing and the structure is a mess. Would not recommend at all.,"Not great, too much filler"
581,B00ABC1131,"[1, 1]",A1XYZ582,Rachel M.,1417564800,05 5 2014,5,Beautifully crafted and deeply insightful. The storytelling is brilliant and the characters are very well developed. Five stars without hesitation.,Wonderful journey
582,B00ABC1358,"[2, 2]",A1XYZ583,Chris A.,1417651200,08 12 2013,5,Wonderful storytelling throughout. The author clearly put a lot of effort into this book. Five stars without hesitation.,Insightful and well written
583,B00ABC1385,"[0, 5]",A1XYZ584,Amanda O.,1417737600,03 20 2013,5,Superb content and beautifully written. I came away with a completely new understanding of the subject. I finished it in two days and immediately bought the sequel.,Brilliant masterpiece
584,B00ABC1059,"[2, 3]",A1XYZ585,Kenneth G.,1417824000,01 21 2014,1,Not what I expected at all. The book is full of errors and contradictions. I regret purchasing this book.,"Poor quality, rushed writing"
585,B00ABC1074,"[3, 7]",A1XYZ586,Frank B.,1417910400,07 22 2015,5,"Excellent book, very well researched. The level of detail is impressive and the writing flows beautifully. A worthwhile investment.",A real gem
